{
  "id": "saveGenerationToProject",
  "label": "Save generation to project",
  "category": "data",
  "description": "Queue this row's generation (image/video/text) to be saved under Library/{projectId}/generations/. Use variableName for the output variable (e.g. generatedImage, combinedVideo from Combine videos or Run generator).",
  "defaultAction": {
    "type": "saveGenerationToProject",
    "variableName": "generatedImage",
    "projectIdVariable": "{{projectId}}",
    "folder": "generations",
    "namingFormat": "numeric"
  },
  "formSchema": [
    { "key": "runIf", "label": "Run only if (row variable; skip when empty/falsy)", "inputType": "text", "placeholder": "e.g. {{generatedImage}}" },
    { "key": "variableName", "label": "Variable containing generation (data/blob URL, e.g. generatedImage or combinedVideo)", "inputType": "text", "placeholder": "generatedImage" },
    { "key": "projectIdVariable", "label": "Project ID (variable or literal)", "inputType": "text", "placeholder": "{{projectId}} or leave empty for selected project" },
    { "key": "folder", "label": "Subfolder under project", "inputType": "text", "placeholder": "generations" },
    { "key": "namingFormat", "label": "Filename format", "inputType": "select", "options": [["numeric", "001, 002, ..."], ["row", "row-1, row-2, ..."]] }
  ]
}
