{
  "id": "raydiumClmmSwapBaseOut",
  "label": "Raydium swap (CLMM, exact out)",
  "category": "data",
  "description": "CLMM **swap base out**: exact **output** in `amountOutRaw`; max input from `slippageBps` via `PoolUtils.computeAmountIn` (SDK: `swapBaseOut`). Optional `amountInMaxRaw` overrides the on-chain cap. Pair with **raydiumClmmSwap** (fixed **in**) when you know input vs output side. Rebuild: npm run build:raydium.",
  "defaultAction": {
    "type": "raydiumClmmSwapBaseOut",
    "runIf": "",
    "poolId": "",
    "inputMint": "",
    "outputMint": "",
    "amountOutRaw": "",
    "slippageBps": 50,
    "amountInMaxRaw": "",
    "cluster": "mainnet-beta",
    "rpcUrl": "",
    "skipSimulation": false,
    "skipPreflight": false,
    "saveSignatureVariable": "solanaTxSignature",
    "saveExplorerUrlVariable": "solanaExplorerUrl",
    "saveAmountInMaxVariable": "",
    "saveAmountInExpectedVariable": "",
    "saveAmountOutVariable": ""
  },
  "formSchema": [
    { "key": "runIf", "label": "Run only if (optional)", "inputType": "text" },
    { "key": "poolId", "label": "CLMM pool id (base58)", "inputType": "text" },
    { "key": "inputMint", "label": "Input mint (leg you spend)", "inputType": "text" },
    { "key": "outputMint", "label": "Output mint (exact amount)", "inputType": "text" },
    { "key": "amountOutRaw", "label": "Amount out (raw, exact)", "inputType": "text" },
    { "key": "slippageBps", "label": "Slippage (basis points, on max in)", "inputType": "number" },
    { "key": "amountInMaxRaw", "label": "Max in raw (optional override)", "inputType": "text" },
    { "key": "cluster", "label": "Cluster", "inputType": "select", "options": [
      { "value": "mainnet-beta", "label": "mainnet-beta" },
      { "value": "devnet", "label": "devnet" }
    ] },
    { "key": "rpcUrl", "label": "RPC override", "inputType": "text" },
    { "key": "skipSimulation", "label": "Skip simulation", "inputType": "checkbox" },
    { "key": "skipPreflight", "label": "Skip preflight", "inputType": "checkbox" },
    { "key": "saveSignatureVariable", "label": "Save signature variable", "inputType": "text" },
    { "key": "saveExplorerUrlVariable", "label": "Save explorer URL variable", "inputType": "text" },
    { "key": "saveAmountInMaxVariable", "label": "Save max in raw (optional)", "inputType": "text" },
    { "key": "saveAmountInExpectedVariable", "label": "Save expected in raw (optional)", "inputType": "text" },
    { "key": "saveAmountOutVariable", "label": "Save amount out raw (optional)", "inputType": "text" }
  ]
}
